names,date_x,score,genre,overview,crew,orig_title,status,orig_lang,budget_x,revenue,country,year,poster_url
Inception,,8.8,"Sci-Fi, Action",A mind-bending thriller about dreams,Leonardo DiCaprio,Inception,Released,English,0.0,0.0,Unknown,2010,https://image.tmdb.org/t/p/w500/ljsZTbVsrQSqZgWeep2B1QiDKuh.jpg
Titanic,,8.7,"Romance, Drama",A tragic love story on a sinking ship.,Leonardo DiCaprio,Titanic,Released,English,0.0,0.0,Unknown,1997,https://image.tmdb.org/t/p/w500/9xjZS2rlVxm8SFx8kPC3aIGCOYQ.jpg
The Dark Knight,,9.0,"Action, Crime",Batman fights the Joker in Gotham City.,Christian Bale,The Dark Knight,Released,English,0.0,0.0,Unknown,2008,https://image.tmdb.org/t/p/w500/qJ2tW6WMUDux911r6m7haRef0WH.jpg
Interstellar,,8.6,"Sci-Fi, Adventure",Space explorers search for a new home.,Matthew McConaughey,Interstellar,Released,English,0.0,0.0,Unknown,2014,https://image.tmdb.org/t/p/w500/gEU2QniE6E77NI6lCU6MxlNBvIx.jpg
The Wolf of Wall Street,,8.2,"Drama, Biography",A stockbroker's rise and fall.,Leonardo DiCaprio,The Wolf of Wall Street,Released,English,0.0,0.0,Unknown,2018,https://image.tmdb.org/t/p/w500/kW9LmvYHAaS9iA0tHmZVq8hQYoq.jpg
